<?xml version = "1.0" encoding="ISO-8859-1"?>
<!-- Henry Cheung College of Staten Island -->
<!-- CSC226 Fall 2013 Assignment 8 -->
<!-- Modeled after Deitel Fig. 15.10 -->
<!-- Simple W3C XML Schema document -->
<!-- standard Schema language definition uses the standard namespace xs: -->
<xs:schema xmlns:xs = "http://www.w3.org/2001/XMLSchema"    
   elementFormDefault="qualified">

<xs:element name="dog">
   <xs:complexType>
     <xs:sequence>
	  <xs:element name="item" maxOccurs="unbounded"> 
	   	<xs:complexType>
         	  <xs:sequence>
		     <xs:element name="num" type="xs:string"/>
		     <xs:element name="breed" type="xs:string" minOccurs="0"/>
         	     <xs:element name="quantity" type="xs:string"/>
         	     <xs:element name="price" type="xs:string"/>
      	 	  </xs:sequence>
   		</xs:complexType>
	   </xs:element>
      </xs:sequence>
   </xs:complexType>
</xs:element>
</xs:schema>